{"case_id":"096863c0eb3e41e4ab7df15714e6492b","generated_at":"2025-11-28T07:59:37.348123","timeline_events":7,"inconsistencies":0,"missing_evidence":["Verify alibis and cross-check with CCTV timestamps.","Obtain statements from neighbors and nearby residents.","Check for forensic reports (fingerprints, DNA analysis, blood spatter analysis).","Collect phone records and call logs if applicable."],"report_path":"storage\\reports\\096863c0eb3e41e4ab7df15714e6492b.pdf","preview":{"timeline":[{"time":"08:50 PM","source":"document_0","event":"01, Sai Apartment, Lane 3, Shivaji Nagar, Pune\nIncident Details:\nOn 18 March 2025, at approximately 20:50 hrs, I heard loud shouting and noises consis","notes":null},{"time":"09:00 PM","source":"document_0","event":"and noises consistent with a\nphysical fight coming from Flat 302 (residence of Arun Patil)","notes":null},{"time":"09:00 PM","source":"document_2","event":"s falling coming\nfrom Flat 302","notes":null},{"time":"09:40 PM","source":"document_0","event":"(Flat 303)\n3","notes":null},{"time":"10:15 PM","source":"document_1","event":"x: Male\nAddress: Flat 302, Sai Apartment, Shivaji Nagar, Pune\nDate of Examination: 18/03/2025\nTime: 22:15 hrs\nInjury Report:\n1","notes":null},{"time":"11:10 PM","source":"document_0","event":"RT (FIR)\nPolice Station: Shivaji Nagar Police Station, Pune\nFIR No: 423/2025\nDate: 18/03/2025\nTime: 23:10 hrs\nComplainant:\nName: Ramesh Kulkarni\nAge: ","notes":null},{"time":"11:45 PM","source":"document_2","event":"Age: 36\nAddress: Flat 301, Sai Apartment, Shivaji Nagar, Pune\nStatement Given On: 18/03/2025\nTime: 23:45 hrs\nI was inside my flat when I heard continu","notes":null}],"inconsistencies":[],"generated_at":"2025-11-28T07:59:37.348123","evidence_map":{"case_persons":["18 March 2025","Action Taken","Arun Patil","Arun Patil\nAge","Blunt Force Trauma","Complainant","Flat 302","House","Injury Report","Kulkarni","Meera Deshpande","Occupation","Patient Details","Pune","Pune\nIncident Details","Pune\nStatement Given","Ramesh Kulkarni","Sai Apartment","Sanjay Patil","Sassoon General Hospital","Sections Applied","Sharp Weapon Injury","Shivaji Nagar","WITNESS STATEMENT\nStatement Recorded Under Section"],"case_locations":["Flat 302","Kulkarni","Ramesh Kulkarni"],"case_timestamps":[],"case_injuries":["Blunt Force","Deep laceration","laceration"],"case_weapons":["Knife","knife","weapon"],"ipc_sections":["307","324","452"],"fir_numbers":[],"mlc_numbers":[],"hospital_names":["Sassoon General Hospital","Victim shifted to Sassoon General Hospital"],"vehicle_numbers":[],"files":[{"file":"FIR_Arun_Patil_Case.pdf","type":"document","classification":{"label":"general_document","confidence":0.5,"method":"fallback"},"summary":"FIRST INFORMATION REPORT (FIR)\nPolice Station: Shivaji Nagar Police Station, Pune\nFIR No: 423/2025\nDate: 18/03/2025\nTime: 23:10 hrs\nComplainant:\nName: Ramesh Kulkarni\nAge: 36\nOccupation: Accountant\nAddress: Flat 301, Sai Apartment, Lane 3, Shivaji Nagar, Pune\nIncident Details:\nOn 18 March 2025, at approximately 20:50 hrs, I heard loud shouting and noises consistent with a\nphysical fight coming from Flat 302 (residence of Arun Patil). Around 21:00 hrs, I observed an unknown\nmale, approximately 5’"},{"file":"MLC_Report_Arun_Patil.pdf","type":"document","classification":{"label":"general_document","confidence":0.5,"method":"fallback"},"summary":"MEDICO-LEGAL CASE REPORT (MLC)\nSassoon General Hospital, Pune\nMLC No: 1198/2025\nPatient Details:\nName: Arun Patil\nAge: 34\nSex: Male\nAddress: Flat 302, Sai Apartment, Shivaji Nagar, Pune\nDate of Examination: 18/03/2025\nTime: 22:15 hrs\nInjury Report:\n1. Sharp Weapon Injury:\n- Deep laceration approximately 7 cm on left forearm\n- Edges clean-cut, likely caused by sharp-edged weapon\n2. Blunt Force Trauma:\n- Contusion on left side of head\n- Swelling observed around temple region\n- Caused by impact wit"},{"file":"Witness_Statement_Ramesh_Kulkarni.pdf","type":"document","classification":{"label":"general_document","confidence":0.5,"method":"fallback"},"summary":"WITNESS STATEMENT\nStatement Recorded Under Section 161 CrPC\nName: Ramesh Kulkarni\nAge: 36\nAddress: Flat 301, Sai Apartment, Shivaji Nagar, Pune\nStatement Given On: 18/03/2025\nTime: 23:45 hrs\nI was inside my flat when I heard continuous shouting and sounds of household items falling coming\nfrom Flat 302. The noise continued for 5–10 minutes. When I came outside at around 21:00 hrs, I\nnoticed a man running down the stairs in a hurried manner. He appeared to be around 5'10\", medium\nbuild, wearing a"}],"consolidated_text":"FIRST INFORMATION REPORT (FIR)\nPolice Station: Shivaji Nagar Police Station, Pune\nFIR No: 423/2025\nDate: 18/03/2025\nTime: 23:10 hrs\nComplainant:\nName: Ramesh Kulkarni\nAge: 36\nOccupation: Accountant\nAddress: Flat 301, Sai Apartment, Lane 3, Shivaji Nagar, Pune\nIncident Details:\nOn 18 March 2025, at approximately 20:50 hrs, I heard loud shouting and noises consistent with a\nphysical fight coming from Flat 302 (residence of Arun Patil). Around 21:00 hrs, I observed an unknown\nmale, approximately 5’10”, wearing a black shirt and blue jeans, running down the staircase. The man\nappeared to be holding a metallic object in his right hand.\nUpon entering the flat with another neighbor, we found Arun Patil lying near the sofa with injuries on his\nleft arm and head. Blood was visible on the floor near the living room.\nSections Applied:\n- IPC Section 452 – House-trespass after preparation for hurt\n- IPC Section 324 – Voluntarily causing hurt by dangerous weapons\n- IPC Section 307 – Attempt to murder\nWitnesses Listed:\n1. Ramesh Kulkarni\n2. Sunita More (Flat 303)\n3. Sanjay Patil (Flat 301)\nAction Taken:\n- Victim shifted to Sassoon General Hospital at 21:40 hrs\n- Knife-like object recovered near staircase landing\n- CCTV footage collected from apartment main gate camera\n---\nMEDICO-LEGAL CASE REPORT (MLC)\nSassoon General Hospital, Pune\nMLC No: 1198/2025\nPatient Details:\nName: Arun Patil\nAge: 34\nSex: Male\nAddress: Flat 302, Sai Apartment, Shivaji Nagar, Pune\nDate of Examination: 18/03/2025\nTime: 22:15 hrs\nInjury Report:\n1. Sharp Weapon Injury:\n- Deep laceration approximately 7 cm on left forearm\n- Edges clean-cut, likely caused by sharp-edged weapon\n2. Blunt Force Trauma:\n- Contusion on left side of head\n- Swelling observed around temple region\n- Caused by impact with hard object\n3. Vital Assessment:\n- Pulse: 98/min\n- BP: 110/70\n- Consciousness: Semi-conscious on arrival\nDoctor’s Opinion:\n- The injury on the arm is consistent with a sharp-edged weapon like a knife.\n- Head injury may indicate struggle or assault.\n- Injuries could be life-threatening without timely medical assistance.\nDoctor:\nDr. Meera Deshpande\nMBBS, MD (Emergency Medicine)\nRegistration No: 88231\n---\nWITNESS STATEMENT\nStatement Recorded Under Section 161 CrPC\nName: Ramesh Kulkarni\nAge: 36\nAddress: Flat 301, Sai Apartment, Shivaji Nagar, Pune\nStatement Given On: 18/03/2025\nTime: 23:45 hrs\nI was inside my flat when I heard continuous shouting and sounds of household items falling coming\nfrom Flat 302. The noise continued for 5–10 minutes. When I came outside at around 21:00 hrs, I\nnoticed a man running down the stairs in a hurried manner. He appeared to be around 5'10\", medium\nbuild, wearing a black shirt and blue jeans.\nAlthough the corridor lighting was dim, I could see that he was holding something metallic in his right\nhand. I cannot confirm whether it was a knife, but it appeared sharp.\nWhen I, along with my neighbor Sanjay Patil, entered the flat, we found Arun Patil lying unconscious\nwith blood near his left forearm and head. We immediately called the police helpline number 100.\nThis statement is true to the best of my knowledge.\n(Signature)\nRamesh Kulkarni\n18/03/2025"},"case_summary":"LLM reasoning error: Error code: 429 - {'error': {'message': 'You exceeded your current quota, please check your plan and billing details. For more information on this error, read the docs: https://platform.openai.com/docs/guides/error-codes/api-errors.', 'type': 'insufficient_quota', 'param': None, 'code': 'insufficient_quota'}}"}}